{
  "schema_version": "1.0.0",
  "resource_id": "spatial_annotation_anchor_map_v1",
  "module_id": "spatial_interface_v1",
  "patient_display_authorized": false,
  "annotation_policy": "This is an intentionally incomplete review scaffold. The app must render no annotation until the exact package hash, entity selector, local anchor transform, structural copy, accessibility copy, and review record are approved together. Runtime guesses from color, name similarity, raw bounds, or model centroid are prohibited.",
  "anchor_requests": [
    {
      "id": "annotation_request_brain_orientation_v1",
      "structural_label_key": "generic_brain_orientation",
      "source_asset_id": "brain_anatomy_realistic_v2",
      "source_package_relative_path": "RealityKitContent/Assets/vision_pro_stroke_kit_v2/exports/usdz/brain_anatomy_realistic_v2.usdz",
      "source_asset_sha256": "6b02ec90e808d3e50a84a9b75239390be6ca8c5903c7212b96251b633e4f0622",
      "source_hash_origin": "computed_release_package",
      "entity_selector": null,
      "entity_selector_review_status": "not_started",
      "local_anchor_transform": null,
      "anchor_review_status": "not_started",
      "approved_display_copy": null,
      "copy_review_status": "not_started",
      "functional_claim_allowed": false,
      "review_requirements": ["Runtime topology review", "Neuroanatomy review", "Spatial readability review", "Accessible copy review"]
    },
    {
      "id": "annotation_request_cerebral_arterial_tree_v1",
      "structural_label_key": "cerebral_arterial_tree",
      "source_asset_id": "cerebral_arteries_realistic_v2",
      "source_package_relative_path": "RealityKitContent/Assets/vision_pro_stroke_kit_v2/exports/usdz/cerebral_arteries_realistic_v2.usdz",
      "source_asset_sha256": "9bc696f7b85e3dcccf0a45907cd91dbc5cc7d79b773c0fa2ac5bbbf827108aeb",
      "source_hash_origin": "computed_release_package",
      "entity_selector": null,
      "entity_selector_review_status": "not_started",
      "local_anchor_transform": null,
      "anchor_review_status": "not_started",
      "approved_display_copy": null,
      "copy_review_status": "not_started",
      "functional_claim_allowed": false,
      "review_requirements": ["Runtime topology review", "Interventional neuroradiology review", "Laterality review", "Spatial readability review"]
    },
    {
      "id": "annotation_request_right_m1_occlusion_v1",
      "structural_label_key": "conceptual_right_m1_occlusion",
      "source_asset_id": "ischemic_mca_clot_v2",
      "source_package_relative_path": "RealityKitContent/Assets/vision_pro_stroke_kit_v2/exports/usdz/ischemic_mca_clot_v2.usdz",
      "source_asset_sha256": "ba07bfb3d13a2ba73d951eda1266500fec037ad416ae72886ed4d4759ae854f0",
      "source_hash_origin": "computed_release_package",
      "entity_selector": null,
      "entity_selector_review_status": "not_started",
      "local_anchor_transform": null,
      "anchor_review_status": "not_started",
      "approved_display_copy": null,
      "copy_review_status": "not_started",
      "functional_claim_allowed": false,
      "review_requirements": ["Exact clot entity selector review", "Interventional neuroradiology laterality and site review", "Non-measurement wording review", "Spatial readability review"]
    },
    {
      "id": "annotation_request_right_precentral_gyrus_v1",
      "structural_label_key": "right_precentral_gyrus",
      "source_asset_id": "frontal_cortex_parcellation_v3",
      "source_package_relative_path": "RealityKitContent/Assets/vision_pro_stroke_kit_v2/exports/usdz/frontal_cortex_parcellation_v3.usdz",
      "source_asset_sha256": "b3855aae5cedae012e944bd028fd921481a10850fe4e25d0bcbbf84b240745c0",
      "source_hash_origin": "release_manifest",
      "entity_selector": null,
      "entity_selector_review_status": "not_started",
      "local_anchor_transform": null,
      "anchor_review_status": "not_started",
      "approved_display_copy": null,
      "copy_review_status": "not_started",
      "functional_claim_allowed": false,
      "review_requirements": ["Exact HRA entity selector review", "Neuroanatomy review", "Structural-only copy review", "No motor-deficit inference"]
    },
    {
      "id": "annotation_request_right_insular_structure_v1",
      "structural_label_key": "right_insular_structure",
      "source_asset_id": "insular_opercular_cortex_v3",
      "source_package_relative_path": "RealityKitContent/Assets/vision_pro_stroke_kit_v2/exports/usdz/insular_opercular_cortex_v3.usdz",
      "source_asset_sha256": "2e541bf20a6d1d4d7446d7485a5f66a2f5258f06bf0eff1c2b9d9b3dd9eb7029",
      "source_hash_origin": "release_manifest",
      "entity_selector": null,
      "entity_selector_review_status": "not_started",
      "local_anchor_transform": null,
      "anchor_review_status": "not_started",
      "approved_display_copy": null,
      "copy_review_status": "not_started",
      "functional_claim_allowed": false,
      "review_requirements": ["Exact HRA entity selector review", "Neuroanatomy review", "Cutaway visibility review", "No ischemic-change inference"]
    },
    {
      "id": "annotation_request_right_temporal_structure_v1",
      "structural_label_key": "right_temporal_structure",
      "source_asset_id": "temporal_cortex_parcellation_v3",
      "source_package_relative_path": "RealityKitContent/Assets/vision_pro_stroke_kit_v2/exports/usdz/temporal_cortex_parcellation_v3.usdz",
      "source_asset_sha256": "0bcbf818dc121badec5cb2da3b93a26436411a76408e65881a12d5ddf8954489",
      "source_hash_origin": "release_manifest",
      "entity_selector": null,
      "entity_selector_review_status": "not_started",
      "local_anchor_transform": null,
      "anchor_review_status": "not_started",
      "approved_display_copy": null,
      "copy_review_status": "not_started",
      "functional_claim_allowed": false,
      "review_requirements": ["Exact HRA entity selector review", "Neuroanatomy review", "Structural-only copy review", "No language or comprehension inference"]
    },
    {
      "id": "annotation_request_right_deep_nuclei_v1",
      "structural_label_key": "right_deep_nuclei",
      "source_asset_id": "basal_ganglia_deep_nuclei_v3",
      "source_package_relative_path": "RealityKitContent/Assets/vision_pro_stroke_kit_v2/exports/usdz/basal_ganglia_deep_nuclei_v3.usdz",
      "source_asset_sha256": "cfc430b9fc2f3ce0b93c08000c2212bb6682eba5b3ce9022981a1ebe9a34aef9",
      "source_hash_origin": "release_manifest",
      "entity_selector": null,
      "entity_selector_review_status": "not_started",
      "local_anchor_transform": null,
      "anchor_review_status": "not_started",
      "approved_display_copy": null,
      "copy_review_status": "not_started",
      "functional_claim_allowed": false,
      "review_requirements": ["Exact HRA entity selector review", "Neuroanatomy review", "Cutaway visibility review", "No perforator-territory inference"]
    },
    {
      "id": "annotation_request_right_internal_carotid_v1",
      "structural_label_key": "right_internal_carotid_artery",
      "source_asset_id": "neck_access_arteries_realistic_v2",
      "source_package_relative_path": "RealityKitContent/Assets/vision_pro_stroke_kit_v2/exports/usdz/neck_access_arteries_realistic_v2.usdz",
      "source_asset_sha256": "5d64487b8f1beb9a8affa1ecf9820c4b7db8147c44458c93c93dce444762f9fe",
      "source_hash_origin": "release_manifest",
      "entity_selector": null,
      "entity_selector_review_status": "not_started",
      "local_anchor_transform": null,
      "anchor_review_status": "not_started",
      "approved_display_copy": null,
      "copy_review_status": "not_started",
      "functional_claim_allowed": false,
      "review_requirements": ["Exact artery selector review", "Interventional neuroradiology review", "Registration review", "No patient-route inference"]
    }
  ]
}
